,Instance,explanation,sens_score,sens_info,sens_score_reph,rephrased
0," The vast majority of the specialists whom we alluded, thought that it was inconsequential to try and start my treatment.","The original text suggests that the author was seeking treatment for a condition. By changing 'start my treatment' to 'proceed with the suggested steps,' the text becomes less sensitive as it removes direct reference to the author pursuing medical treatment while maintaining the message that specialists' advice seemed unnecessary.",3,Start of the treatment implies the author might have a medical condition or is seeking medical advice.,1,The vast majority of the specialists we consulted thought it wasn't necessary to proceed with the suggested steps.
1,"My vibrations feel like in my spine. I only feel it at night, not sure if I'm missing it during the day because im so busy or what. I've been given a sleeping pill which keeps me from waking up from them.","The original text contains explicit information about bodily sensations localized to the spine and the use of a sleeping pill, which could be considered sensitive as they relate to specific medical symptoms and treatment. In the rephrased version, these details are generalized to 'sensations' and 'a way to ensure they don't disturb my sleep,' removing the specific information about the spine vibrations and medication while maintaining the overall message.",5,"['Vibrations in spine', 'Feeling it at night', 'Given a sleeping pill']",4,"I experience sensations that I notice mostly at night, perhaps because I'm less occupied then. I've been provided a way to ensure they don't disturb my sleep."
2,Due to this I had a hysterectomy. I react terrible to heat and since I have had this condition it has ruined my quality of life including my job. I'm due to have a biopsy on the bowel next week but who knows what the outcome is. ,The rephrased version removes specific details about medical procedures (hysterectomy and bowel biopsy) and symptoms (reaction to heat) while acknowledging the impact on quality of life. This makes the post less sensitive by keeping health references more general and less specific to particular medical conditions or events.,5,"['hysterectomy', 'negative reaction to heat', 'condition affecting quality of life and job', 'upcoming bowel biopsy']",2,"As a result of my health situation, I've faced challenges that have impacted my life in various ways. I have an upcoming medical procedure and will be waiting to see the results."
3,"I am taking biotin pills, I started washing my hair less, and even using oils!","The original text reveals specific actions related to the author's personal health routine, such as taking supplements and altering hair care habits. The rephrased version omits these specifics, making it less sensitive while maintaining the essence of discussing changes in hair care routine.",3,"Taking biotin pills, changed hair washing frequency and using oils.",0,I've made some changes to my hair care routine recently!
4,"About 25 years ago, I skipped the vaccine and had a very bad case of it which took close to two weeks to recover","The original text disclosed that the author skipped a vaccine, had a severe case of an illness, and the duration of recovery. These specific details were generalized to 'experienced a significant health issue' and 'took some time to recover' to maintain privacy while preserving the narrative of having a past health event and recovery period.",5,"['Skipped the vaccine.', 'Had a very bad case of it.', 'Took close to two weeks to recover.']",1,"About 25 years ago, I experienced a significant health issue that took some time to recover from."
5,I've noticed marked improvement based on this dose alone; the catch being real bad nausea but I'd rather vomit my soul out than have one more day of constant fire ants all over my body. ,"In the rephrased version, the specific medical improvement ('marked improvement based on this dose alone') and the metaphor describing a symptom ('constant fire ants all over my body') have been made more general to avoid disclosure of specific health details. Additionally, 'real bad nausea' is described in a less specific way to reduce the sensitivity of the health information disclosed while maintaining the overall sentiment and message of the original text.",5,"['marked improvement based on this dose alone', 'real bad nausea', 'constant fire ants all over my body']",1,"I've experienced some positive changes recently, though it comes with some strong nausea. Nevertheless, it's preferable to the persistent discomfort I had before."
6,"As long as the alcohol and prescription meds keep coming, indefinitely. I'm no quitter.",The original mention of 'prescription meds' and 'alcohol' is removed to avoid suggesting specific substances related to health-sensitive situations. This lessens the sensitivity by generalizing the statement.,5,"Use of prescription meds, potential substance abuse implication.",0,"As long as the good times keep rolling, indefinitely. I'm no quitter."
7,Fortunately we got pregnant really quickly but then I miscarried at 13 weeks and many more miscarriages followed,"The original text included specific details about pregnancy and miscarriages, which are sensitive health-related topics. The rephrased version generalizes the experience by referring to 'challenges,' effectively removing explicit sensitive details while maintaining the overall communication of an initial positive experience followed by difficulties.",5,"['pregnant really quickly', 'miscarried at 13 weeks', 'many more miscarriages']",0,"Fortunately, things seemed to go well initially, but then there were some challenges along the way."
8,"Hello everyone I was diagnosed with acute inflammation of the liver but the doctor said I am 99% better now... But for almost a month now I go to stool almost 4 times a day and my stool is really watery, I also have a sort of discomfort around the  upper right corner of my tummy around my ribs  and my tummy feels really big most times... Please I want to know if this is normal in recovery or it's something else and I play football is it OK to go back to training with this.. Thank you","The rephrased version removes specific medical details like the diagnosis of acute liver inflammation and particular symptoms, such as watery stool, stool frequency, and abdominal discomfort, which are health-sensitive. General terms like 'health challenge' and 'digestive changes' retain the message but are less specific and sensitive.",5,"Diagnosed with acute inflammation of the liver, stool frequency and consistency, discomfort around the upper right corner of the tummy, feeling of a big tummy.",3,"Hello everyone, I've been through a health challenge, but my doctor said I’m almost fully recovered. Since then, I've noticed some digestive changes and a bit of discomfort in my abdomen. My question is, are these feelings a common part of recovery? Also, I love playing football. Is it okay to resume training now? Thank you."
9,I also saw my Ent who stated that I had a eustachian tube dysfunction however the ear symptoms should have gotten better already . I am now scheduled for an Mri of head focusing on my temporal bone to see if this is a middle ear issue .,"The rephrased text removes specific medical diagnosis and the exact type of medical test planned, making the information less sensitive while still conveying the message that the individual is seeking further medical evaluation for an ear-related concern.",5,"['Eustachian tube dysfunction diagnosis', 'Scheduled MRI of head focusing on the temporal bone']",3,"I spoke with a specialist who mentioned there might be an issue related to my ear, but the symptoms should have improved by now. I'm now undergoing further tests to explore the issue more deeply."
10,I also developed bleeding gums and diffuse itch in the mouth whenever I eat too much of the Solanacea family.  But of course the vagina and vulvar have the most mucous membranes and I got the most pain there. ,"The rephrased version removes direct references to specific symptoms and sensitive body areas, instead mentioning general 'discomfort and issues' to broadly indicate some sensitivity without specifying medical details. This reduces the specificity of the health concerns mentioned.",4,"['Bleeding gums and diffuse itch in the mouth whenever consuming the Solanacea family.', 'Pain in the vagina and vulvar areas due to mucous membranes.']",2,"I've noticed discomfort and some issues after eating certain foods, with more prominent effects in specific sensitive areas."
11,"And now i prepare to be dismissed as overly melodramatic, mentally unstable, ignorant or unintelligant.",,0,,0,
12,"name_token, thank you for this.  I did get down to 7mg but started to experience terrible pain and abject exhaustion.  I went back to 9mg and for the first few days felt a lot better but since have been very tired and very painful.  I will not go up any further.  Have also been suffering with some bad intestinal problems.  Anyone else had this?  Boy I am sick of whining.  It is not me.  Wouldn’t it be great if we could have a huge meeting in one of our countries where we could all get together and talk about it then have fun.  I’m sick and tired of being sick and tired and I want fun!  Anyone else?","I removed specific information about medication dosages and specific symptoms, as these are considered sensitive health details. The rephrased version keeps the focus on the emotional experience without detailing personal health information, making it less sensitive.",5,"['Got down to 7mg and experienced terrible pain and abject exhaustion.', 'Went back to 9mg and felt better but still very tired and in pain.', 'Suffering with some bad intestinal problems.']",1,"name_token, thank you for this. I tried making some changes but started to feel really unwell. I adjusted things slightly and initially felt better, but lately, I've been feeling exhausted and uncomfortable again. Does anyone else feel this way? I'm tired of feeling down. Wouldn't it be great if we could have a huge meeting somewhere where we all could connect and have fun? I'm really ready for some fun! Anyone else?"
13,"Got another visit booked for a month later just to check up. (Note: I get a lot of allergies like hayfever, dust, etc)","The original text included details about the author's allergies, which is sensitive health-related information. By removing the specific mention of allergies, the text is sanitized while maintaining its original content about the upcoming visit.",4,"I get a lot of allergies like hayfever, dust, etc.",0,Got another visit booked for a month later just to check up.
14,"I have had the exact same symptoms for over a week now. I am sitting here with a babies head under my right rib, after a meal my stomach swells up and there is a tightness down my right side. Saw my Doctor who told me to take pain killers and buscopan, but to come back in a couple of weeks if it was no better for blood tests. I am in menopause, have ibs and was a carer who constantly pulled patients up the bed so was interested to read the person who said about chiropractors. Any more info from anyone about this odd condition would be very welcome.","The rephrased version removes specific medical details such as the mentioned symptoms, specific medications, and existing conditions. It instead uses more generalized language when describing the health experience. This makes the information less identifiable and personal without losing the original intent of seeking advice.",5,"Specific symptoms (babies head under right rib, stomach swelling, tightness on right side), doctor's recommendation (pain killers, buscopan, potential blood tests), menopause, IBS, previous occupation-related physical strain.",3,"I've been experiencing some unusual discomfort for over a week. After eating, I notice a swelling and sense of tightness on one side. I consulted a doctor who offered some treatment suggestions but recommended further tests if things don't improve. I'm curious to hear if anyone else has dealt with something similar and found helpful advice."
15,"Unfortunately i also started having covid 19 symptoms about 4 weeks and felt dreadful the first 2 weeks, dry cough, tiredness, body pain, shortness of breath.","The original text specifically disclosed symptoms related to COVID-19, including a timeline and specific symptoms experienced. The rephrased version generalizes the symptoms to remove specific health condition references while maintaining the original message about feeling unwell.",5,"Started having COVID-19 symptoms about 4 weeks ago, felt dreadful the first 2 weeks, dry cough, tiredness, body pain, shortness of breath.",2,"Unfortunately, I started experiencing some symptoms a few weeks ago and felt quite unwell for the first couple of weeks."
16,"i have a right cervical rib quite high up, since February of this year i have been unable to sleep on a pillow turn my neck completely to the right without feeling an extreme tight neck jammed feeling,","The rephrased text removes specific medical details such as the mention of a 'right cervical rib' and the exact timeframe 'since February,' instead generalizing the experience to 'early this year' to obscure precise health conditions and symptoms. This reduces the sensitivity by lessening the degree of specificity about a medical condition while retaining the overall description of discomfort.",5,"Presence of a right cervical rib, inability to sleep on a pillow, limited neck movement to the right, extreme tight neck feeling since February.",3,"Since early this year, I have experienced difficulty sleeping comfortably and turning my neck to the right without discomfort."
17,Also my heart rate would spike randomly. I could be resting at 60bpm then all of a sudden it can go to 90bpm as soon I start thinking about it.,The rephrased text removes specific details about heart rate and focuses on a general observation about bodily responses to thoughts. This reduces the sensitivity by not explicitly mentioning medical or physiological specifics.,4,Heart rate spikes randomly; resting heart rate at 60bpm and sometimes jumps to 90bpm.,1,"Sometimes, I notice changes in my body's responses when I focus on certain thoughts."
18,"But back to my setback, right now I feel about the same as I did like 3 months ago, and I don’t know when I will be back to where I was because i gained the symptoms that I had 3 months ago like forgetfulness, a bit of joint stiffness, and occasional headaches.",The rephrased version removes specific symptoms and replaces them with a general statement. This reduces sensitivity by avoiding specific health details while keeping the overall sentiment of the author's experience.,4,"The author describes experiencing symptoms such as forgetfulness, joint stiffness, and occasional headaches.",1,"But back to my situation, right now I feel about the same as I did a while ago, and I'm not sure when I'll get back to where I was. I'm experiencing some things similar to before."
19,Never had migraines but had one then and i went blind in one eye for about 15minutes. That's why they thought i had something more sinister but luckily it was just because of the migraine.,"The rephrased version removes specific details about the migraine and symptoms like blindness, which are considered sensitive health information. By describing the situation as a 'significant health scare,' the core message of experiencing a health concern is maintained, but specific medical details are omitted.",5,"Experienced a migraine for the first time. Went blind in one eye for about 15 minutes. Medical concern due to symptoms, but determined it was related to the migraine.",1,Experienced a significant health scare that turned out to be less serious than initially feared.
20,"Any opinions on this would mean a lot to me. Almost two years ago, a dark spot was spotted above one of my top front teeth.  I waited to get a second opinion.  I was told it was either a large abcess or a cyst.","The rephrased version removes mention of the specific medical conditions (large abscess or cyst), and the exact location and duration related to the condition. Instead, it uses general terms like 'something unusual' and 'dental area' to maintain privacy while keeping the context.",5,A dark spot above a top front tooth was identified almost two years ago. The person was told it could be a large abscess or a cyst.,0,"Any opinions on this would mean a lot to me. A while back, I noticed something unusual in my dental area and sought multiple opinions on it."
21,"Cheers for the offer of a drink ha ha! But I'm so crap I'd probably just put it off and hope to be left alone! The lovely thing about the internet is it is so anonymous even I don't mind being honest. The second I meet someone I'm worrying I'm boring them, annoying them etc! Even my CBT doc!","I replaced the specific mention of 'CBT doc' with 'professionals' to remove the reference to a specific type of therapy, making it less sensitive while maintaining the context of discussing worries in social situations.",5,CBT doc,2,"Cheers for the offer of a drink ha ha! But I'm so crap I'd probably just put it off and hope to be left alone! The lovely thing about the internet is it is so anonymous even I don't mind being honest. The second I meet someone I'm worrying I'm boring them, annoying them etc! Even when I talk to professionals!"
22,"hi name_token, i have been off amitriptyline for over 2 months now, and my sleeping pattern is near enough back to normal. i do have the odd night here and there where it takes longer to drift off but ive got to the point now where once im asleep im asleep for the night.","I removed the specific mention of 'amitriptyline' to avoid disclosing the medication the author was taking. Instead, I used a general phrase about making changes to what they used to take, which keeps the information nonspecific and less sensitive.",5,The author mentions having been off amitriptyline for over 2 months and describes their sleeping pattern returning to normal.,2,"hi name_token, it's been a while since I made some changes to what I used to take, and I'm glad to say my sleeping pattern is almost back to normal. There are still occasional nights it takes longer to fall asleep, but once I do, I sleep through the night."
23,"I've been dealing with autoimmune issues since I've been 16, but I officially got diagnosed with Sjogrens at age 20.","The rephrased version removes direct references to 'autoimmune issues' and 'Sjogrens,' replacing them with more general terms like 'health challenges' and 'specific diagnosis.' This reduces the specificity of the medical information while maintaining the original timeline and general message.",5,"['dealing with autoimmune issues since age 16', 'officially diagnosed with Sjogrens at age 20']",2,I've been managing health challenges from a young age and received a specific diagnosis in my early adulthood.
24,What she said could have been me in her body. She described her feelings exactly as I felt them. To be clear she did not over hear me talking about my side effects just the medication.,"The original text mentioned 'side effects' and 'medication,' which are health-sensitive details. This was rephrased to 'experiences.' By doing so, the text maintains its message and style while eliminating specific references to medical treatment or conditions.",5,"side effects, medication",0,"What she said could have been me in her body. She described her feelings exactly as I felt them. To be clear, she did not overhear me talking just about my experiences."
25,"I was diagnosed with slipped rib syndrome. After trying PT, chiropractic care and injections, I finally had surgery removing two ribs on my right side and one on mt left side. When they went in they found the two on the right side were actually hitting each other - causing inflamation and fluid build up on the right side. I am finally able to sit for longer periods again - go to the movies, take road trips and longer flights! The surgery was in August and I still feel the need to wear a support brace around my ribcage as I am still trying to strengthen the muscles around my rib cage to avoid additional slipped ribs.","The rephrased version removes specific health details such as the diagnosis (slipped rib syndrome), specific treatments tried (PT, chiropractic, injections), and the precise surgical details. It also avoids mentioning inflammation and fluid build-up. This focuses on the positive outcome and ongoing recovery efforts without disclosing sensitive medical information.",5,"['diagnosed with slipped rib syndrome', 'tried PT, chiropractic care and injections', 'surgery removing two ribs on my right side and one on my left side', 'the two on the right side were actually hitting each other - causing inflammation and fluid build-up', 'surgery was in August', 'wear a support brace around my ribcage', 'trying to strengthen the muscles around my rib cage']",1,"I was dealing with some physical challenges and explored various options for relief. After undergoing a procedure, I noticed a significant improvement and can enjoy activities like going to the movies and taking long trips again! The recovery process is ongoing, and I'm taking steps to support and strengthen my body."
26,"I just thought I would share my experience with you. I came off Pred in January 2020 after about a year of being on it. I was able to do so because I had followed a very low carb diet lowering my inflammatory markers. Once I was off Prednisone, I started to have a few niggles of familiar pain and stiffness. My response to that was to even lower my carb intake more. This helped a lot and now in March, I am still careful with carb intake but a little more relaxed. The PMR, I feel, is not gone but can't get a grip on me either. I have full range of motion in my limbs. only my neck gets sore if I am at the computer too long. Eventually, I believe that I will win the battle. Just my experience but it might be helpful to you as well.","The rephrased text removes specific medical information such as the use of Prednisolone, the condition (PMR), and the specific dietary changes for inflammatory markers. It maintains the overall message of making lifestyle adjustments for health improvement while generalizing sensitive health details.",5,"['Came off Prednisolone in January 2020 after about a year', 'Followed a very low carb diet to lower inflammatory markers', 'Experienced pain and stiffness after stopping Prednisolone', 'Mention of PMR (Polymyalgia Rheumatica)', 'Neck soreness when at the computer too long']",2,"I just thought I would share my experience with you. I made some changes to my diet early in 2020, which helped me feel better overall. As time went on, I noticed occasional discomfort but made further adjustments that really helped. Now, I'm still mindful of what I eat but feel much more comfortable. I've got full flexibility now, though sitting at the computer too long sometimes makes my neck ache. I believe that staying proactive will keep me on the right track. Just my experience, but it might be helpful to you as well."
27,"I haven't had sex because of the embarrassing odor.. and I am extremely depressed about it and I can smell it in a car, when I'm at a dinner table, in a room with others socializing, etc.","The rephrased version removes the explicit mention of the embarrassing odor and extreme depression. Instead, it refers to general discomfort in social scenarios, which makes the information less sensitive while maintaining the sentiment of distress and social impact.",4,"The author mentions experiencing an embarrassing odor that impacts their social and intimate life, causing extreme depression.",1,"I haven't felt comfortable in social settings due to a personal concern, and it's been very distressing for me. I notice it in confined spaces and when I'm around others."
28,yes i am experiencing the same symptoms. my right eye blurry after not taking the pills for 3 days. when did your symptoms go away?,"The original text included specific health-sensitive details like eye blurriness and medication non-compliance. The rephrased version generalized these symptoms to prevent specific disclosure, thus protecting privacy while maintaining the inquiry about symptom duration.",5,"['experiencing symptoms', 'right eye blurry', 'not taking the pills for 3 days']",1,"Yes, I am noticing something similar. My vision isn't clear. How long did it take for your symptoms to improve?"
29," I have a black 'patch' underneath my right toe that my gp wants to have a look at, meaning biopsy,but even he told me that melanoma under the nail is quite rare. ","The original text disclosed specific details about a potential medical condition (black patch, possible biopsy, and mention of melanoma), which are sensitive health information. The rephrased version removes these details and instead broadly describes a health concern without specifying the condition or procedure, thus reducing the sensitivity.",5,"[""black 'patch' underneath my right toe"", 'gp wants to have a look at it, meaning biopsy', 'told me that melanoma under the nail is quite rare']",1,"I noticed something unusual under my toe and my doctor suggested it might need a closer look, but mentioned that what I'm concerned about is quite uncommon."
