,Instance,explanation,sens_score,sens_info,sens_score_reph,rephrased
62,"I was tested for Hemachromatosis mutation which returned a negative result. Since then I've had 5 more tests with ferritin over 370 and no higher than the 450, saturation staying around 42-48%. I was referred to a hematologist who said to keep having repeat tests.","The rephrased text removes specific medical test results, such as the Hemachromatosis mutation test and specific ferritin and saturation levels, replacing them with more general terms. References to a hematologist are generalized to 'monitoring my health.' This sanitizes the text by avoiding precise medical language, making it less sensitive.",5,"['Tested for Hemachromatosis mutation and result was negative.', '5 more tests with ferritin levels over 370 and no higher than 450, saturation around 42-48%.', 'Referred to a hematologist for repeat tests.']",2,"I underwent genetic testing which showed a negative result. I've had some follow-up tests indicating higher than normal levels, and I've been advised to keep monitoring my health."
63,"I had PRP 8 weeks ago in both elbows. I was at level 2-3 pain at the time. But got the PRP because everyone I started working out again the pain came back in full force. I was PRP was a like a miracle procedure, and would be able to work out in 4 weeks.","The rephrased text removes specific details about the PRP treatment and the exact location (elbows) where it was administered. It also generalizes the level of pain and the timeline, making the description less specific to personal health experiences while maintaining the overall message of the original text.",5,"PRP treatment, 8 weeks ago, both elbows, level 2-3 pain, working out pain returning",3,I underwent a procedure a couple of months back in hopes of addressing discomfort in a specific area. I had some relief initially but noticed that resuming my exercises brought back the discomfort. I thought the procedure would work wonders and allow me to exercise again relatively quickly.
64,"Do you live in the UK?  If you do try to get an appointment with Dr , Dermatology Sheffield Hallamshire Hospital she is the UK's expert on Urticaria.  Other specialists know a bit but she specialises in our problem.  I asked for an antidepressant and was given Doxepin because it has a built in antihistamine. ","The specific mention of 'Urticaria' and being prescribed 'Doxepin' was removed to protect the author's sensitive health information. The revised text keeps the focus on seeking professional expertise and exploring treatment options for general skin issues, without specifying conditions or medications.",5,"The author discloses having sought treatment for Urticaria and was prescribed the antidepressant Doxepin, which has an antihistamine component.",1,"Do you live in the UK? If you do, try to get an appointment with Dr. [Name] at the Dermatology department of Sheffield Hallamshire Hospital; she's an expert on skin problems. Other specialists know a bit, but she focuses on these issues. I also explored options and found some medications that might help with related challenges."
65,"I went to the dentist who prescribed amoxicillin but it did nothing. A few days later I lost smell and taste, then neurological symptoms started.","The original text contains specific health-sensitive information: the prescription of a specific medication (amoxicillin), as well as specific symptoms (loss of smell and taste, neurological symptoms). The rephrased version removes the specific medication name and details about the symptoms, making it more general and less identifying while maintaining the overall experience shared by the author.",5,"['Prescribed amoxicillin', 'Lost smell and taste', 'Neurological symptoms started']",1,"I went to the dentist who prescribed something, but it didn't help. A few days later, I experienced some unusual changes."
66,I have had two TKRs in the last three months. I too was very sick and the crash teams attended me twice as I passed out. Neither time could I raise my leg until at least 2 weeks Post op.,"The rephrased version removes specific details about the medical procedures (TKRs) and the exact timeline (three months, two weeks Post op). It also generalizes the mention of severe illness and emergency interventions ('very sick,' 'crash teams attended,' 'passed out') to reduce sensitivity while retaining the overall message about facing health challenges and recovery issues.",5,"['two TKRs in the last three months', 'very sick', 'crash teams attended', 'passed out', 'could not raise leg until at least 2 weeks Post op']",2,I went through some recent health procedures and faced significant challenges during recovery. It took a while before I could regain some normal functions.
67,"My issue is I had an MRI, that the radiologist report stated he believed the scan was highly suggestive of MS or other demyelinating issue based off of my scan","I removed the specific mention of an MRI, the radiologist's explicit suggestion of MS or demyelinating issues, and details based on the scan to generalize the information and protect the privacy of the author's medical details.",5,"['MRI results', ""Radiologist's suggestion of MS or other demyelinating issue"", 'Details based off of scan']",2,"I recently had a scan, and the report suggested a potential concern."
68,"hi name_token - i have swollen knees & my left leg overall feels ""puffy"" - actually i would say my whole lower half appears ""puffy"".","The original text included specific symptoms such as 'swollen knees' and 'puffy' sensations, which are health-sensitive. The rephrased version removes these specific symptoms and uses more general terms to describe a change, reducing the specificity of the health-related information.",4,"swollen knees, left leg feels 'puffy', whole lower half appears 'puffy'.",1,"hi name_token - i notice some changes in my knees and legs, as they seem different than usual."
69,"I never though I might have Tinnitus. Thats quite peculiar. can I ask, do you have the swollen head feeling? Also feel like you have low blood sugar?I dont have much vertigo anymore but if Im standing up, I get winded very easily and it makes me feel like throwing up. Especially if I try carrying something.Does that happen to you?","The rephrased text removes explicit mentions of the potential diagnosis of Tinnitus and specific symptoms such as low blood sugar and vertigo. Instead, it generalizes the sensations and frames them as unexpected experiences. This reduces the sensitivity by avoiding direct linkage to health conditions while maintaining the original inquiry into whether others have similar sensations.",5,"['The author may have Tinnitus.', 'Feels like having a swollen head.', 'Feels like having low blood sugar.', ""Doesn't have much vertigo anymore."", 'Feels winded and like throwing up when standing up, especially when carrying something.']",3,"I have been experiencing some unexpected sensations lately. Do you ever feel as if there's increased pressure in your head? Also, have you ever felt unusually fatigued when standing, especially if doing chores? Curious to hear your experiences."
70," when my car accident happened a few weeks ago, the seat belt and steering wheel left large bruises all over my scars from the bypass surgery. ","Removed specific mentions of 'bypass surgery' which is a specific medical event, and rephrased 'large bruises all over my scars' to 'noticeable marks' to omit specific descriptions of injuries related to past surgeries. This makes the text less sensitive by avoiding explicit health and medical history details.",5,"Car accident, large bruises, scars from the bypass surgery.",2,"When the car accident occurred a few weeks ago, the seat belt and steering wheel left noticeable marks."
71, I finally had a root canal done late last year and was told that would clear it up.  Well today I had my first x-ray since the procedure and the dark spot is still there and has grown a little .What is going on?,"The rephrased text removes specific details about the dental procedure (root canal) and the particular issue (dark spot), making the information less specific and sensitive. It maintains the overall concern about a persistent issue without revealing detailed medical information.",5,"Root canal procedure, dark spot still present and has grown",3,"I had a dental procedure done late last year and was informed it would resolve the issue. Today, during a follow-up, I found out the issue persists. Any ideas on why?"
72,"Every Dr is different, but i had to basically become my own advocate and signed up with the patient portals to view and read results of certain test. Back when i had my hernia diagnosis a couple years ago","The original text specifies a 'hernia diagnosis a couple years ago,' which is a specific medical condition and time frame. This could identify the individual's health history. By removing the specific condition and timeframe, the revised text maintains the message about self-advocacy and using patient portals without disclosing sensitive health information.",5,hernia diagnosis a couple years ago,0,"Every Dr is different, but I had to basically become my own advocate and signed up with the patient portals to view and read results of certain tests a while back."
73,"I'm starting to experience what I would describe as ""brain fog"". I lose my train of thought easily, and am forgetting things I normally would not.","The rephrased version avoids using the term 'brain fog,' which can be indicative of specific health conditions. Instead, it uses more general language like 'feel a bit scattered' and 'hard to concentrate,' which lessen the medical sensitivity of the statement.",4,The text describes experiencing 'brain fog' and mentions losing train of thought easily and forgetting things.,3,I'm beginning to feel a bit scattered and occasionally find it hard to concentrate or remember details.
74,Ive noticed over the past few months to have some irregular bleeding/discharge in between periods. I am 29 years old. Ive tracked it and noticed it's about a 7-10 days after my period ends. ,"The rephrased version removes specific references to symptoms like 'irregular bleeding/discharge' and instead uses the term 'irregular patterns' which is less specific and sensitive. Additionally, instead of stating '29 years old', 'in my late twenties' is used to provide age context without exact details. This makes the information less identifiable while maintaining the overall message of monitoring changes over time.",4,"['irregular bleeding/discharge in between periods', '29 years old', ""tracked it and noticed it's about a 7-10 days after my period ends""]",3,"I've been monitoring some irregular patterns a few months after my cycles, typically occurring a week or so after they finish. I'm in my late twenties."
75,I had gastric sleeve surgery 7 months ago and the surgeon sent me back home with photos of an ectopic bulge on my pancreas to take to my GP.,"The rephrased version removes specific references to the type of surgery (gastric sleeve), the exact timing (7 months ago), and the detailed medical finding (ectopic bulge on the pancreas). Instead, it uses more general terms like 'medical procedure' and 'specific issue,' thereby reducing the sensitivity while retaining the essence of needing follow-up care.",5,"Gastric sleeve surgery 7 months ago, ectopic bulge on the pancreas, surgeon's instructions regarding a GP visit",2,"Several months back, I underwent a medical procedure, and afterwards, I was advised to consult my doctor about a specific issue that was observed."
76,"I think mine was due to persistent thrush infection and the many remedies I tried to cure it, including home remedies such as bathing in a bath with some cider vinegar in - that made my soreness much worse (chemical trauma).","The original text mentioned specific health-related details such as the type of infection, remedies, and results of those remedies. The rephrased version generalizes these details to avoid direct mention of any specific health condition or treatment, thus reducing the sensitivity.",5,"['persistent thrush infection', 'many remedies I tried to cure it', 'bathing in a bath with some cider vinegar in', 'soreness much worse (chemical trauma)']",0,"I tried various methods to deal with an issue, including some home approaches which unfortunately aggravated the condition."
77,Some people don't have the will power to stop things that are bad for them and you did. Ocd is real trust me I have it with my house.,"The original text discloses the author's personal health condition, OCD, which is considered sensitive information. The rephrased version removes the specific mention of OCD while maintaining the acknowledgment of challenges, thus making the text less sensitive.",5,['Ocd is real trust me I have it with my house.'],0,"Some people don't have the willpower to stop things that are bad for them, and you did. It's important to recognize how challenges can be very real."
78,"I think I’m on the same train as you. Day 6, and I feel like I’m dying. Nausea, shakes, aches, diarrhea. Thinking about a hospital trip to make sure my kidneys and liver are doing ok.","The original text was rephrased to remove specific symptoms and the consideration of a hospital visit related to kidney and liver concerns. This makes the text less sensitive by avoiding specific health conditions and symptoms, while keeping the general message of feeling unwell.",5,"['Day 6, and I feel like I’m dying.', 'Nausea, shakes, aches, diarrhea.', 'Thinking about a hospital trip to make sure my kidneys and liver are doing ok.']",1,"I think I’m on the same train as you. It's been quite challenging, and I'm considering getting some medical advice to ensure everything's alright."
79,"Hi name_token, ive been on here a million times with my bad migraines, so I'm not going to bore everyone, just wanted to say they are no fun they are hormone related and they really do scare you and make you feel like you could honestly be having a stroke or seizure, mine do cycle themselves all the time and can be a bit different every time..","The rephrased version removes specific health-sensitive details such as the mention of 'migraines,' their 'hormone-related' cause, and comparisons to 'stroke or seizure.' By doing this, it generalizes the health concern, maintaining privacy while still conveying the message.",5,"['bad migraines', 'hormone related', 'feel like you could honestly be having a stroke or seizure', 'cycle themselves all the time and can be a bit different every time']",2,"Hi name_token, I've posted here many times about recurring issues, so I won't go into detail, just wanted to share that they can really be concerning and vary from time to time."
80,i am 52 years old and for years I've felt worthless and so unhappy,"The rephrased text removes the author's specific age and the duration of their feelings, which are personal health-sensitive details. This generalization preserves the author's sentiment while protecting their privacy.",3,The author's age and years of feeling worthless and unhappy.,2,I've often struggled with feelings of worthlessness and unhappiness.
81,"I have no appetite and force myself to eat. ANXIETY! never had in my life, and the insomnia is terrible. Hopefully over soon I am 51 in July.","The references to 'no appetite' and 'force myself to eat', 'anxiety', and 'insomnia' have been removed to avoid disclosing specific symptoms or health issues. The mention of age is also removed as it could be considered personal information. This makes the text less sensitive while retaining a hopeful and personal tone.",4,"['No appetite', 'Force myself to eat', 'Anxiety', 'Insomnia', 'Age (51 in July)']",0,I've been having some unusual experiences lately. Hoping for brighter days ahead as I approach a new milestone!
82,"I have the exact symptoms as name_token.  Have had them for 3 years.  Mine started with the fluttering sensation when I would laugh hard or bend over. Then it started feeling tender after eating a large meal, the same as i felt when pregnant like a pressure causing the soreness. But not painful. Now I feel some soreness in my back occasionally on the same right side. I don't really have the fluttering anymore but the past couple of weeks when I twist or bend a certain way  or slouch down the exact same spot will have a burning or stinging sensation that just lasts a few seconds.   I had bloodwork and ultrasound about a year ago and they didn't find anything. I am not overweight but I do have a desk job so I sit alot. I do exercise almost everyday.... walking, treadmill, elliptical and a recumbant bike. I have wondered if it has to do with my posture sitting at desk on computer. I do sort of lean to the right side using the mouse.  Or maybe hormones? I am 50.","The rephrased text removes specific details about symptoms and medical evaluations while still conveying the author's concerns about recurring physical sensations. The reference to age and direct symptoms descriptions were also omitted, keeping the privacy of personal health details intact. This makes the text less sensitive by avoiding explicit disclosure of the author’s health experiences.",5,"['Exact symptoms as another individual', 'Duration of symptoms (3 years)', 'Symptoms: fluttering sensation, tenderness after eating a large meal, soreness in back, burning or stinging sensation', 'Medical evaluations: bloodwork and ultrasound results were negative', 'Age (50)']",2,"I've been experiencing some recurring sensations over the past few years. Initially, it would occur during certain physical activities. Recently, I've noticed some physical sensations while seated for long periods, particularly in one position. Medical evaluations haven't shown any issues. I have an active lifestyle and spend time sitting at my desk using the computer, which might contribute to these sensations."
83,"My doctor finds my symptoms to be very unusual, and put me on Colofac for IBS which has not helped. I also have heartburn around this time of my menstrual cycle and am on Somac.","The rephrased version removes specific references to IBS, heartburn, the menstrual cycle, and mentions of specific medications like Colofac and Somac, which are health-sensitive details. Instead, it generalizes the experience and references to treatment, maintaining the style and message while avoiding exposure of sensitive health information.",5,"['Symptoms considered unusual by the doctor', 'Taking Colofac for IBS', 'Heartburn around menstrual cycle', 'Taking Somac']",1,"My doctor mentioned that what I'm experiencing is uncommon, and I'm trying some treatments. I also notice certain discomforts around specific times each month."
84,I have a lopecia that moves around as well and all of my hair is thinner. ,"The rephrased version removes the specific mention of 'alopecia' and the symptom of thinner hair, thus stripping away the health-sensitive details while maintaining the overall message about hair changes.",5,"The mention of 'alopecia,' which refers to a specific medical condition related to hair loss. The detail about hair being thinner is also related to this medical condition.",1,I've noticed changes in my hair recently.
85,"Thanks name_token.  Glad I’m not alone in this.  Me too up and down with intestinal problems.  Had tests , no infection or anything so we will see what comes next.  We’ll keep up to date.","The original text mentioned 'intestinal problems' and 'had tests, no infection,' which are disclosures of specific health conditions and tests. In the rephrased version, I've generalized the 'intestinal problems' to 'experiencing this' and rephrased 'had tests, no infection' to 'have had some checks done, but no specific issues were found,' which generalizes the specific health concerns and testing while maintaining the overall message of seeking answers.",5,"Intestinal problems, Had tests, no infection",3,"Thanks name_token. Glad I’m not alone in experiencing this. I've been dealing with some ups and downs and have had some checks done, but no specific issues were found. We'll see what's next and keep up to date."
86,"I'll constantly be looking in the mirror and brush off skin flakes every few minutes. The other day, I was cleaning my keyboard; I flipped it upside down and it FREAKING SNOWED SKIN FLAKES EVERYWHERE. GFD IT ALL.","In the rephrased version, the specific mention of 'skin flakes' is replaced with a more general term, 'stuff,' which removes the health-sensitive detail about skin conditions while maintaining the author's tone and message.",4,The text describes the author's experience with frequent skin flaking.,0,"I often find myself checking the mirror and tidying up. Recently, I was cleaning my keyboard and a surprising amount of stuff fell out!"
87,"Can confirm, I'm taking 30mg for about a year now and I've gained quite a bit","I removed specific dosage information and the period of time to reduce the specificity of the treatment details. I also generalized the impact as 'changes' to avoid direct mention of weight gain, thus making the information less sensitive.",5,Taking 30mg for about a year; gained quite a bit.,1,"Can confirm, I've been on this for a while now and I've noticed some changes."
88,I have pain across the back of my hands and my finger joints ache a lot still.,"The original text specifically mentioned 'pain' and 'ache' in particular parts of the body, which are specific symptoms. The rephrased version uses the word 'discomfort' and 'certain areas' to generalize these symptoms, making the statement less specific and, therefore, less sensitive.",4,Pain across the back of hands and aching finger joints.,1,I feel discomfort in certain areas of my hands and fingers.
89,Citalopram on 10mg and it was very effective. My symptoms went away about 2 weeks after and haven't returned. Also did yoga and relaxation breathing too.,"The original text mentioned a specific medication (Citalopram) along with the dosage and the timing of symptom relief, which are health-sensitive details. The rephrased text removes this specific information, keeping the focus on the general practice of yoga and relaxation breathing, which is non-sensitive.",5,Citalopram on 10mg and it was very effective. My symptoms went away about 2 weeks after and haven't returned.,0,I found a routine that was very effective. I also tried yoga and relaxation breathing.
90,I have a week tummy and nausea has been a big problem for me along with weight loss. ,"The rephrased version removes specific health-related terms like 'week tummy', 'nausea', and 'weight loss', and generalizes them to 'discomfort' and 'challenging for my routine'. This reduces the sensitivity by not explicitly mentioning specific symptoms or conditions.",4,week tummy and nausea has been a big problem for me along with weight loss,1,I've been experiencing some discomfort and it's been challenging for my routine.
91,I still have bouts of nausea but I don't think it is from the iron infusion but from my spells of off balance/dizziness and I'm yet to find a Dr who can tell me what is causing it. My naturopath suspects it is still my inflamed stomach which takes a minimum of 6 weeks to heal.,"The original text includes various health-sensitive information such as symptoms (e.g., nausea, dizziness), specific treatments (e.g., iron infusion), and a specific diagnosis (inflamed stomach). The rephrased version removes these specific health details and provides a general overview without identifying specific conditions or treatments, reducing the sensitivity.",5,"['bouts of nausea', 'iron infusion', 'off balance/dizziness', 'naturopath', 'inflamed stomach', 'minimum of 6 weeks to heal']",1,I'm experiencing some discomfort but have not determined the cause yet. I'm consulting with healthcare professionals to figure out what's going on.
92,I've got three more days on the antibioics and all they've done is increase my diarrehea (like I needed that!).  I've had no improvement whatsoever with my symptoms. ,The sensitive information related to the specific medication (antibiotics) and symptom (diarrhea) has been generalized to 'treatment' and 'discomfort'. The overall dissatisfaction with the lack of improvement has been retained without specifying the medical details. This rephrasing keeps the essence of frustration while omitting health-sensitive specifics.,5,"['antibiotics', 'diarrhea', 'no improvement in symptoms']",2,I've been really frustrated lately with a treatment I'm on. It's been challenging dealing with increased discomfort and seeing no progress.
93," My ferritin was an 8, so 60 is pretty good.","The specific ferritin levels (8 and 60) were removed to obscure direct health information, creating a more general statement about improved health. This makes the text less sensitive while retaining the positive sentiment about the improvement.",5,Ferritin level of 8; current ferritin level of 60.,0,I'm happy with the improvement in my health indicators.
94,"The gynecologist I spoke to just said to me i think with your periods starting to become irregular, I highly doubt you will have children and sorry you don't qualify for IVF and the cut off age is 43 and you are 43 now,","The rephrased version removes specific references to the author's irregular periods and their current age, which are sensitive health details. By generalizing the information about eligibility for treatments and age restrictions, we maintain the overall message without disclosing specific health conditions.",5,"['periods starting to become irregular', 'doubt you will have children', ""don't qualify for IVF"", 'cut off age is 43 and you are 43 now']",3,The doctor I consulted said it's unlikely I'll have children and mentioned that I don't meet the criteria for certain treatments due to age restrictions.
