,Instance,explanation,sens_score,sens_info,sens_score_reph,rephrased
260,"""I just want to say I love all of you , the fact that there are others like me helps me everyday . Deep deep down it hits a piece of me that is dark and helps greatly because I know I am 38 now and can't change anything or expect anything out of talking ( because I am not a talker really hate the grind of talk that has no meaning) but if I find some solitude even for 15 min then it is worth it at this point . I am at a all time high on not being able to take it ! So ty all and hopefully one day some of us will find each other and have a real impact on our lives .",,1,,0,
261,Can’t win get money need to spend immediately. Take meds feel too much don’t take feel nothing. I don't know what to do rly,"I removed the specific reference to 'meds' and their effects. Instead, the rephrased text reflects general emotional or decision-making struggles without revealing health-related information.",5,The text discusses taking medications and the effects of taking or not taking them.,0,Having a hard time managing finances. Decisions about taking action feel overwhelming. Unsure about what steps to take.
262,My mother died of lung cancer as well and so I'm afraid to leave these symptoms unchecked for too long.,"The rephrased text removes the specific mention of the mother's death from lung cancer, which is sensitive as it reveals a family medical history. It also generalizes the concern about symptoms without specifying fear due to a specific medical condition, thereby reducing sensitivity.",5,"['My mother died of lung cancer', 'afraid to leave these symptoms unchecked']",1,"I'm concerned about these symptoms, so I don't want to ignore them."
263, I went to a lot of doctors but they all said nothing was wrong and that I had anxiety.,"The rephrased text removes the mention of anxiety, which is a specific mental health diagnosis. By focusing on the general assurance from professionals about the person's health without specifics, the text maintains its message while safeguarding personal health information.",5,Mention of anxiety as a diagnosed condition.,0,"I consulted many professionals, but they all assured me that everything was fine."
264,"It's not the same colour as jaundice, which in photos I've seen looks more yellowish. Also my eyes are not pigmented.","The original text mentions 'jaundice' and eye pigmentation, which are health-sensitive details related to symptoms and medical conditions. The rephrased version removes specific mentions of jaundice and the nature of the eyes, opting instead for a more general comparison to pictures of certain conditions without explicitly naming them. By doing so, it reduces the level of sensitivity by avoiding medical terminology.",4,"['not the same colour as jaundice', 'eyes are not pigmented']",2,It's different from what I've seen in photos of certain conditions with a yellowish tone. My eyes look normal.
265, This scared me a lot. I then started to worry immensely about having esophageal cancer and again used google to see if I had any of the symptoms. ,"The original text mentions a specific illness (esophageal cancer) and the act of checking for symptoms of this illness, making it highly sensitive. The rephrased version generalizes the health concern and keeps it non-specific, reducing the sensitivity by avoiding direct mention of the specific illness.",5,worry immensely about having esophageal cancer; used Google to see if I had any of the symptoms.,3,This scared me a lot. I then started to worry immensely about my health and again used Google to research symptoms.
266," I have managed to maintain my weight but it is forced... I eat because I know I'm supposed to and I'm on the verge of being underweight, I don't want to lose more but I still don't feel hunger.","The original text explicitly discusses issues related to weight and lack of hunger, which are sensitive health-related details. The rephrased version maintains the concern about eating and stability in weight but removes the more sensitive detail about being on the verge of underweight and not feeling hunger.",4,The author mentions being on the verge of being underweight and not feeling hunger.,3,"I have managed to keep my weight stable, though it's quite challenging. I eat because it's necessary, but I don't have much of an appetite."
267,I'm 53 and after weeks my finger tips are peeling my hands look and feel terrible. ,"The rephrased text omits specific details about the author's age and the peeling fingertips. Referring to hands generally feeling 'rough' reduces the specificity of the symptoms, making it less sensitive while maintaining the general concern about hand condition.",4,The author's age and the condition of their fingertips peeling and hands looking and feeling terrible.,3,"At my age, my hands are looking and feeling rough."
268," 2 years ago I started to get pain on my left rib, felt like constant pain, it then wrapped around the side and then to the back",The rephrased version generalizes the specific areas and nature of the pain to maintain privacy while still conveying the overall message of experiencing discomfort.,4,"Pain on left rib, constant pain, pain wrapping around the side and back",1,"A couple of years ago, I began experiencing discomfort around my torso area."
269,"Trying to think of good things is difficult for me, I can't think of anything I can't put a negative slant on! Maybe I'm good at arguing... But if I look at widely accepted sections of my life it's not a good overall picture:",,0,,0,
270, The pain in my gums and tongue has grown steadily more painful. I tried the salt water remedy which decreases the discomfort a bit.,"The original text mentions specific symptoms (pain in gums and tongue) and a remedy (salt water), which are health-sensitive details. In the sanitized version, the discomfort is referred to generally, and the remedy is described as a simple home remedy without specifying what it is. This reduces the sensitivity by not disclosing direct symptoms or the specific method used for relief.",4,"Pain in gums and tongue, use of salt water remedy for relief.",1,"I've been experiencing some discomfort in my mouth, and using a simple home remedy has provided a bit of relief."
271,"It made me feel downer than I was, I was mis diagnosed numerous times which only ended up being worse.  ","The original text specifically mentions feeling 'downer' and being 'mis diagnosed numerous times,' which indicates a negative impact on mental health and a history of repeated medical evaluations. The rephrased version focuses on the frustration without specifying the emotional state or incorrect diagnoses, thus protecting the individual's sensitive health details.",4,"Feeling down, misdiagnosis numerous times, worsened condition",2,"I was feeling worse even after several diagnoses, which was frustrating."
272,Recently noticed this yellow vertical line on my right toe near the border of nail. Is this fungus,"The original text mentioned a specific symptom observed on the toenail, which can be considered sensitive health information. The rephrased version generalizes the symptom to maintain the privacy of the individual while still expressing the concern.",4,yellow vertical line on my right toe near the border of nail,1,Recently noticed something unusual on one of my toenails. Is this a common issue?
273," I have lost about 10 pounds in the past 1 1/2 months, and it is not intentional by any means. I am normally 110-115 pounds, and I have dropped to 100. ","The rephrased text removes specific details about the amount of weight lost, the timeframe, and that the weight loss was unintentional. This shifts the focus from a detailed personal health experience to a general observation, reducing the sensitivity of the information.",5,"['lost about 10 pounds in the past 1 1/2 months', 'not intentional by any means', 'normally 110-115 pounds, and I have dropped to 100']",1,I have noticed a change in my usual weight range recently.
274,"It varies from person to person but for me the sleep took around a month before I started to get more than 2/3 hours, even then it was only around 5 hours.","The original text disclosed specific details about the individual's sleep pattern, which can be considered health-sensitive as it might imply issues with sleep. By removing specific timeframes and sleep duration, the revised text maintains the message without revealing personal health-related information.",3,"The text mentions the author's sleep pattern, specifically the duration it took to improve sleep and the quantity of sleep achieved initially.",1,"It differs for everyone, but for me, it took some time before I could sleep for a longer duration."
275,"So today has been one of those deceptive clear days. Virtually normal, hardly any cough or breathlessness or energy drops, just sore throat/hoarseness.","The original text references specific symptoms such as cough, breathlessness, energy drops, and sore throat/hoarseness. These details have been generalized to discuss feeling normal, which maintains the message of an unexpectedly good day without citing health-specific symptoms.",4,"Cough, breathlessness, energy drops, sore throat/hoarseness",0,Today felt surprisingly normal. I was able to carry on with my day smoothly.
276,I feel better now. I had a fatigue episode earlier this afternoon where I felt sick and just dead tired again,"The rephrase removes the specific mention of a 'fatigue episode,' feeling 'sick,' and being 'dead tired,' which can imply specific symptoms or conditions. By focusing on managing energy levels, it avoids direct reference to any particular medical issue, making it less specific and sensitive.",4,"fatigue episode, felt sick, dead tired",1,I feel better now after struggling to keep my energy up earlier this afternoon.
277,I was informed it is stress and anxiety before we are protecting our stomaches for the flight or fight.I had it for about three to four weeks ,"The rephrased text removes the specific mention of 'stress and anxiety' and the reference to 'stomaches,' making it less specific while retaining the general idea of experiencing something due to a response to pressure. The phrase is made more general to maintain the original message without disclosing specific health-related details.",4,"Stress and anxiety related to protecting the stomach, duration of three to four weeks.",1,I was told it's common to brace ourselves before dealing with intense situations. It's been happening for a few weeks now.
278,"I now double wash my face morning and night, every single day. I started doing this 5 months ago (July 2014). The improvement was almost instantaneous - days rather than weeks and I have not suffered a single recurrence since (now Jan 2015). That has been a real surprise to me as, in the past, it had always been worst with the onset of Autumn/Winter.","The rephrased version removes sensitive health details by avoiding specific mention of the recurrence of any condition. Instead of indicating past health issues, it generally refers to 'changes with the seasons,' minimizing the sensitivity by not linking the practice of double washing to a specific medical outcome.",4,"The original text includes sensitive information about the author's past issue with a skin condition that worsens in Autumn/Winter and their solution of double washing their face, which led to an improvement.",1,"I now double wash my face morning and night, every single day. I started doing this 5 months ago (July 2014). The improvement was almost instantaneous - days rather than weeks, and I have seen great results since (now Jan 2015). That has been a real surprise to me as I generally notice changes with the seasons."
279,"""I apologise for this post to be slighly off the run of the mill. I don,t really know why this needs to be mentioned, other than the fact that it had such a profound impact on me....(.As brief as poss)...2years ago I was daily visiting my Dad as he fought his cancer.( which I might add survived x2 ). Anyway it was on one of these such visits I came across the cancer unit specifically for teens. As I peered through the glass at them, all I could see was fun, laughter, lots of laughter it was almost infectious. In that brief moment a huge wave of guilt came over me...guilt for feeling so sorry for myself. The thought of losing my Dad, tearing away at me piece by piece. So many people fighting for each breath, a new day etc and yet they still found some form of enjoyment from the desperate situation that they were in..How dare I sit in this huge pile of self pity?, What right did I have contemplating my own demise?. A very humbling experience for me how could it not be for anyone?. This brief encounter completely put things into some form of order, order in my chaotic mind..I am not for one minute implying that wallowing in self pity is your style. Just thought I would share..Good Luck jx","Sensitive information about the author's father's specific illness (cancer) and treatment experience was removed to protect privacy. The anecdote about observing a teen cancer unit was generalized to mention a unit for young people facing health challenges, avoiding direct reference to cancer.",5,Author's father fought cancer and survived twice; author visited a cancer unit for teens.,1,"I apologize if this post is a bit outside the usual. I want to share an experience that greatly affected me. Some time ago, I had frequent visits to see a loved one. During those visits, I noticed a unit dedicated to young people facing health challenges. Despite their situation, there was so much joy and laughter—it was almost contagious. That moment made me feel incredibly guilty for being absorbed in my own struggles. Witnessing others who were facing difficult times yet still finding enjoyment was humbling. It helped me organize my thoughts and appreciate my own life more clearly. I'm not suggesting that everyone else is wrapped up in self-pity; I just felt like sharing. All the best, jx."
280,I also found that I have to use the higher vibration doing flare ups.,"The original text mentions 'flare ups,' which could be indicative of a chronic condition or symptom exacerbation. By rephrasing to 'under certain conditions,' the text becomes less specific, reducing the sensitivity while maintaining the same advice regarding using higher settings.",4,use the higher vibration during flare ups,1,I also found that using higher settings helps under certain conditions.
281,"I guess my first step will be to go to the Doctors and find out for sure , then if as I suspect do have it I will have to make some pretty big disisions .","The rephrased text removes the mention of going to the doctor's specifically and the suspicion of having a particular condition, making the statement less specific and sensitive. It generalizes the action to seeking professional advice for understanding the situation, which still conveys the same overall message without disclosing personal health details.",3,The author mentions the intention to visit the doctor for a diagnosis and suspects having a specific medical condition.,1,I guess my first step will be to seek professional advice to understand my situation better. I anticipate having to make some big decisions based on what I find out.
282,"I had no reasons to think this way, I created them almost. Now I actually have no job etc. I am not a victim, I did it to myself. I think I have just given up, if I see 2015 I will be a little surprised as I imagine something will come along in next few months that will be enough to knock me fully over the edge; an unexpected bill, a worry how I'm impacting on my partner, a death in the family - something...",,0,,0,
283,"""Thanks for your answer. For some reason i feel obliged to say that i'm sorry you feel like you're on your final run, even though that's exactly how i feel as well.","The rephrased version removes the specific wording 'final run,' which could imply serious health concerns or end-of-life circumstances. By focusing on shared emotions without specifying the nature of those feelings, the text is made less sensitive.",3,"The text suggests feelings of being on a 'final run,' which may imply a deteriorating health condition or an end-of-life situation for both the author and the person addressed.",1,"Thanks for your answer. I appreciate your honesty about how you're feeling, and I can relate to those emotions."
284,I feel better now. I had a fatigue episode earlier this afternoon where I felt sick and just dead tired again,"The original text included details about fatigue and feeling sick, which are health-sensitive. The rephrased version maintains the overall message of improvement without specifying the symptoms of fatigue or sickness, reducing the sensitivity.",4,"fatigue episode, felt sick, dead tired",1,"I'm feeling better now. Earlier today, I had a moment where I wasn't feeling my best."
285,This issue happens mostly when I'm standing and when the red blotches pop up they are warm. Every time this happens it seems like they get bigger and recently started appearing on my other leg. ,"The original text mentions specific symptoms – red blotches that appear primarily when standing and feel warm. By rephrasing it to mention 'unusual reddish marks,' it maintains the original concern but is less specific, thus preserving privacy.",4,Red blotches appearing on legs that are warm when standing.,3,"I've noticed something unusual with my legs, where reddish marks show up when I'm on my feet, and they feel warm. Lately, these marks have been beginning to appear on my other leg as well."
286,"I would do anything to find a cure for this, I'm getting so frustrated. I have always been confident and very happy with my appearance, since developig this I have gained weight and don't feel as good about myself as I used to. It's just very hard","The original text suggested the presence of a medical condition by mentioning the need for a cure and associated weight gain. By rephrasing to suggest a 'challenge' and 'changes', the revised version preserves the sentiment without specifying any health condition or related symptoms. This reduces the health sensitivity of the message.",4,"The author expresses a desire to find a cure, indicating a possible medical condition. The text also mentions weight gain and a decrease in self-confidence associated with developing 'this', which implies a health-related issue.",2,"I really wish I could find a solution to this challenge, it's becoming quite frustrating. I used to feel very confident and happy with my appearance, but now I've noticed some changes that make me feel less positive about myself. It's just been very hard."
287,"Hi Marion, I think it was initially harder on my mom when I was first diagnosed since she really understood the scope of it. I am willing to communicate with you and your daughter about my experience.",The term 'diagnosed' is replaced with 'accept' and 'understanding of the situation' to remove direct reference to any medical diagnosis while maintaining the context of the difficulty faced. This minimizes the disclosure of specific health-sensitive information.,5,diagnosed,3,"Hi Marion, I believe it was initially more difficult for my mom to accept, given her understanding of the situation. I'm open to discussing my experiences with you and your daughter."
288,And it's really difficult for me too to cope up with life when small thing makes me feel that its end of life!,"The rephrased text removes the potentially alarming implication of feeling that it's the end of life, which could indicate a mental health crisis. It retains the expression of struggle but in a less severe manner, making it less sensitive.",3,The text suggests emotional or mental health struggles by stating that small things make the author feel like it's the end of life.,2,And it's really difficult for me too to cope with life when small things feel overwhelming!
289, I knew I couldn't be alone with these symptoms but what everyone is describing is exactly what I'm going through!,"The original text refers to experiencing symptoms, which implies a health-related issue. This has been rephrased to more generally mention having relatable experiences without specifying symptoms. This makes the information less sensitive by removing the health implication.",4,The author is experiencing symptoms and believes others are experiencing the same.,0,"I see that many people have shared similar experiences, which is relatable for me!"
290,"  The main reason I am posting this is because I tried many lotions, creams and oils that did not help","The rephrased text removes specific references to 'lotions, creams, and oils,' which imply a personal health or skin issue, thereby making it less explicit. It still conveys the experience of trying multiple products without specifying them, hence reducing sensitivity.",3,"The text details the author's experience with trying various lotions, creams, and oils that did not help, implying a personal skin or dermatological concern.",1,I'm sharing this because I've tested out a lot of different products without much success.
291,"things look strange sometimes especially during the day. slight disorientation and spaced out feeling. makes me feel very slow. i feel this feeling 24/7, excpet at night it lessens a lot. i worry because i move to LA and medical school in two months so ive been a wreck. my life feels like everything is going wrong. focusing on peoples faces is difficult too because i start feeling weird sensations","The rephrased text removes specific mentions of disorientation, spacing out, and weird sensations, which could indicate health issues, while maintaining the overall message of feeling anxious and unfocused. This approach keeps the focus on the emotional state rather than detailing potential health symptoms.",4,slight disorientation and spaced out feeling; feeling very slow; feeling 24/7 except at night it lessens; difficult focusing on people's faces; feeling weird sensations,2,"Things look strange sometimes, especially during the day. I often feel slowed down and a bit off. At night, it's not as intense. I'm anxious because I'm moving to LA for school in two months, and it feels like everything is going wrong. It's also challenging to concentrate on people sometimes."
292,"i am scared that i won’t be able to deal with talking about it in person, i will either appear appear to happy and calm and will be dismissed or i won’t even be able to talk about it without breaking down and crying which will look like i’m faking it. i know, it’s silly to worry about those things but, i do, a lot.",,0,,0,
293,"I give my self a quick massage around the ears, stretch out your neck (SCM) and boom, problem solved. It'll come back, but just rinse and repeat. ",,0,,0,
294,"I still want to be doing better, I still have some pain and a bit of stiffness but please continue with the exercises and ice, ice, ice.","The rephrased version removes the direct mention of 'pain' and 'stiffness,' generalizing it to 'aiming for improvement.' Specific advice like 'ice, ice, ice' is generalized to 'cold therapy.' This makes it less about specific health experiences while maintaining the general sentiment of self-care.",3,"Experiences of pain and stiffness, advice regarding exercises and ice application.",1,"I'm aiming for improvement, and I'm following suggestions to stay active and use cold therapy."
295,Ive had pretty much everything on there at one time or another. At first its very upsetting and bewildering .. but as time goes on you learn to live with it and adjust... some women only have issues for a 6 = 12months.. others it goes on for many years flaring up and calming down.  Sinus issues are common with peri..,"The rephrased version generalizes the author's experiences with health-related challenges without specifying any particular condition or term like 'peri,' which can imply perimenopause. This makes the statement less personal and sensitive, maintaining privacy while keeping the message clear.",4,"The author mentions having 'pretty much everything on there,' suggesting they have experienced multiple health-related issues. They also mention 'sinus issues' and 'peri,' which implies perimenopause-related health concerns.",1,"I've dealt with various challenges at one time or another. Initially, it can be unsettling and confusing, but over time you learn to adapt. Some people experience issues for a limited time, while for others, they persist longer. Sinus concerns can be frequent during certain life stages."
296,So about 3-4 days ago i developed two big bumps on my leg. they both are warm to the touch and are hard underneath my skin.,"The original text specifically mentions 'two big bumps on my leg,' indicating a personal health concern with specific symptoms. The rephrased version generalizes the description to avoid specifics about the bumps, focusing instead on a non-specific unusual observation. This makes the information less sensitive by avoiding detailed personal health descriptions.",4,"Developed two big bumps on leg, warm to the touch, hard underneath skin.",1,Recently noticed something unusual on my leg that feels warm and firm.
297,I have neck pain which often turns into a headache,"The original text specifies neck pain and headaches as symptoms. The rephrased version mentions general discomfort impacting the head and neck without specifying symptoms, reducing sensitivity.",4,"The text mentions neck pain and headache, which are specific symptoms.",3,I often experience discomfort that affects my head and neck.
