,Instance,explanation,sens_score,sens_info,sens_score_reph,rephrased
129,"Another parallel cause and the biggest one of my current state is my love life. I had quite a few girlfriends over the years but none had time for me at the end even though I tried as hard as I could. Last few years were the worst. I have 3rd girl in a row with serious issues and events at home. One had drug addict dad at age of 4 which she had to take care of, while mom left both of them. She had terrible depressions. One had a really big farm at home they couldn't sell and only a demonic mother and 12 year old brother. She just lost her great father to cancer at that time. The one I'm with now has a deeply depressed unemployed extremely possessive mother who's brainwashing entire family since she was a child.","The rephrased version removes specific sensitive details about the lives and family issues of the author's partners, which are not necessary for conveying the author's feelings about the impact of their love life. By generalizing the issues to 'various complicated family situations,' the text respects privacy while maintaining the overall message.",5,"The text includes sensitive information about the author's girlfriends, such as one having a drug addict father, another having a parent who died of cancer, and a third having an unemployed, possessive mother.",2,"Another major factor affecting me currently is my love life. I've had several relationships over the years, but they haven't worked out despite my efforts. Recently, these relationships have been particularly challenging due to various complicated family situations my partners have faced."
130,Pacing in chronic illness - some useful links that explain it and how to do it,"The original text specifies a 'chronic illness,' which is health-sensitive information as it implies a continuing medical condition. By changing 'chronic illness' to 'long-term conditions,' the language becomes more general and less personally sensitive, reducing explicit disclosure of a health condition while maintaining the text's overall message.",5,chronic illness,4,Pacing in long-term conditions - some useful links that explain it and how to do it
131,"It is a shame your GP is unwilling to consider alternative therapies. Stick with the amitriptyline, it will help with pain and sleeping.","The rephrased version removes specific references to 'GP' and 'amitriptyline,' which are considered identifiable medical providers and medications. Instead, it uses general terms like 'doctor' and 'prescribed plan,' which make the advice less specific and less sensitive.",5,GP's unwillingness to consider alternative therapies; use of amitriptyline for pain and sleeping.,2,It's unfortunate that your doctor isn't open to different treatment options. Continuing with the prescribed plan could improve your comfort and rest.
132,"We need new leadership, a new economy.",,0,,0,
133,"Tell yourself that you are not alone, millions of women around the world are going through what you are going through. Praying for you",,0,,0,
134,"Email me all you like, offer me as much money as you like, but you won't get me to comment on any individual case of any illness, ever.",,0,,0,
135,"I must admit I’m glad that I live on my own, as if I had a man in my life I think I would of killed him by now 😂...",,0,,0,
136,"Your blood test results will go up and down if you have lots of infections. We are only in April and if all the infections you have suffered with have stopped, that would usually be a good sign.","The rephrased text removes specific references to infections, which can be considered sensitive health information. Instead, it uses more general language that suggests variability in health factors without specifying illnesses.",4,"The text mentions that the author has had lots of infections, suggesting a history of frequent illness.",1,"Your blood test results can fluctuate due to various factors over time. If any recurring issues have resolved by now, that would usually be a positive indication."
137,"your mum is close to my age , and to be honest she probably knows herself that something's not quiet right .","The original text suggests that the author's mother is aware of a potential health issue. The rephrased version maintains the conversational tone but broadens 'something's not quite right' to 'something seems a bit off,' making it less specific to health-related concerns while preserving the message's intent.",3,The text implies that the author's mother is experiencing some unspecified health-related issue.,2,"Your mum is around my age, and she might have noticed something seems a bit off."
138,"BUT from you history, you just c/o after a week of ( severe grief and even more crying),i want you to read about (Central serous retinopathy).coz it may be one of differential diagnoses.","The original text references specific emotional conditions (severe grief, crying) and a potential medical diagnosis (Central serous retinopathy). The rephrased version removes these specifics, making it less sensitive by referring more generally to past experiences and potential conditions without naming them.",5,"['severe grief', 'even more crying', 'Central serous retinopathy', 'differential diagnoses']",1,"BUT considering your recent experiences, I recommend reading up on various conditions that could be relevant."
139,"name_token, Long may it continue thus for you.",,0,,0,
140,Let us know how you get on.,,0,,0,
141,Australia is beautiful place dont get me wrong and i have some amazing friends but do miss my family a lot as there all back in the UK. I only get to see them like 3 weeks a year and still want to travel more.,,0,,0,
142,"If you know, you know 🤷",,0,,0,
143,"Hi name_token, when you say you have gradually weened yourself off how did you go about it? Missing days or cutting the tablets in half?","The phrases 'weened yourself off' and 'cutting the tablets in half' are related to health treatments and medication. By rephrasing to 'reduced your intake' and 'reducing the portion', the sensitive information about medication management is made less specific, thus making the text less sensitive.",5,"['Gradually weened yourself off', 'Cutting the tablets in half']",1,"Hi name_token, when you say you have gradually reduced your intake, how did you go about it? Skipping some days or reducing the portion?"
144,I can also say that an allergy test on you may come out negative for all panels.,"The original text explicitly references an allergy test and its potential negative result. The rephrased version generalizes the statement to mention tests and allergies without specifying results or implicating specific diagnostic procedures, thereby reducing personal health sensitivity.",4,allergy test on you may come out negative for all panels,1,I can also mention that sometimes tests might not show allergies.
145,Any answers on this? I’m experiencing the same thing word for word !,"The original text mentions experiencing 'the same thing word for word,' which implies specific symptoms or conditions shared with a prior statement or post. Rephrasing it to 'having a similar experience' keeps the message while removing the direct indication of matching health issues, thus reducing sensitivity.",4,Experiencing the same thing word for word.,3,Any answers on this? I'm having a similar experience!
146,Be very careful of potassium. Only take under doctor direction!!  You can actually have a heart attack from too much oral potassium. ,"The original text mentions the risk of a heart attack from too much potassium, which is a specific medical outcome. The rephrased version removes the direct reference to heart attacks and instead mentions 'risks of excessive consumption', which makes the health information less specific and thus less sensitive.",5,The text implies that taking oral potassium can lead to a heart attack.,2,Be cautious with potassium intake and follow professional medical advice. It's essential to understand the risks of excessive consumption.
147,"Now I know I am about to open a can of worms here but .....feeling down or feeling """"blue"""" isin't depression.",,0,,0,
148,I see you are concerned about your Dad. As I understand it Alzheimer's is characterised by failures on a number of aspects of cognative ability and departures from normal behaviour. Such failures are noticed by those living in the same house a few years before a diagnosis may be attempted by professionals.,"The rephrased version removes the specific mention of Alzheimer's, instead generalizing the cognitive and behavior changes without naming a specific condition. This reduces the sensitivity by avoiding direct reference to a particular illness.",5,"The text discusses Alzheimer's, which is a specific illness.",3,"I understand you're worried about your Dad. From what I gather, certain cognitive changes and behavior shifts might be observed by family members some years before an official assessment."
149, Sometimes people lose weight due to over stress or depression. Do you feel anything like that? I think you should see your doctor ASAP.,"The rephrased text generalizes the health impact (such as weight loss) and conditions (stress or depression) to 'changes in their physical health due to stress or mood changes.' This removes specific references to 'weight loss' and 'depression,' making the text less sensitive while maintaining the overall concern and advice to seek professional help.",4,"The text mentions weight loss due to stress or depression, and advises seeing a doctor, indicating potential mental and physical health issues.",2,Sometimes people experience changes in their physical health due to stress or mood changes. Are you feeling anything similar? I recommend talking to a professional.
150,TREAT yourself with a gift that you can/will enjoy long term.,,0,,0,
151,"Good luck, stay safe and all the best 😊",,0,,0,
152,"""thanks for your help man.",,0,,0,
153,"I know it sucks. I lost my job and had to take care of my family. At times like this, call on your friends to leave food at your door. ",,0,,0,
154,Tomorrow I may clean the extractor filter and brasso the stair rods. 🙄,,0,,0,
155,"I'm a 53 year old single mother to basically 8 adult children,(baby will be 18 on the 27th) and 12 grandchildren.",,0,,0,
156,Best of Luck!,,0,,0,
157,I can also say that an allergy test on you may come out negative for all panels.,"The original text mentions allergy tests and results, which is health-sensitive information. The rephrased version generalizes the situation by discussing test results without specifying the type of test or exact outcome, making it less health-sensitive.",4,"An allergy test result being negative for all panels, implying a discussion about possible allergies.",1,It's possible that test results might not show a positive result even if there are symptoms.
158,"""I both agree and disagree!",,0,,0,
159,I am sure Trumps are raking in money from this pandemic in more ways then we all know. Is he also selling Med Equipment to Putin?,,0,,0,
160,"If you lose time and time again at chess, and you hate the game as well, do you carry on playing?",,0,,0,
161,I have exact same symptoms any results,"The rephrased text removes the direct mention of 'symptoms', thereby reducing the specificity of the health condition being referred to. It still conveys the message that the author is looking for shared experiences or results without explicitly mentioning health symptoms.",4,"The phrase 'I have exact same symptoms' implies that the author is experiencing specific symptoms, which is considered health-sensitive information.",3,"I've noticed I'm facing something similar, any results?"
162,.... I could never get tired of watching You,,0,,0,
163,I became the father of a baby boy at the age of 31. It was indeed the happiest day of my life. He was like a normal baby earlier. But slowly I and my wife realized that there were some changes in his behavioral pattern. ,The phrase 'changes in his behavioral pattern' implies potential health-related concerns regarding the child's development. Rephrasing it to 'noticed some unique aspects of his development' lessens the health-sensitive implication and focuses on the observation without suggesting a health condition.,3,Changes in the behavioral pattern of the baby.,1,"I became the father of a baby boy at the age of 31. It was indeed the happiest day of my life. Over time, we noticed some unique aspects of his development."
164,Don’t sign a bad book deal. Make some money!!,,0,,0,
165,Skype is great! Hence we Skype the grandkids who are very young and funny!,,0,,0,
166,"I'm sorry to hear this.  Wouldn't prednisone also help the pulmonary fibrosis, however?  In which case maybe it's too soon to be tapering at all, let alone by these large steps.  But I really don't know, I have no medical training, but maybe a question to ask the doctor.","The original text mentioned specific details about a medication (prednisone) and a medical condition (pulmonary fibrosis). To desensitize the information, these specific terms were replaced with more general terms such as 'a treatment' and 'the condition' without delving into explicit medical details.",5,Reference to prednisone use for pulmonary fibrosis and tapering medication.,2,"I'm sorry to hear this. Wouldn't a treatment also help the condition, however? In which case maybe it's too soon to be reducing it at all, let alone by these large steps. But I really don't know, I have no medical training, but maybe a question to ask the doctor."
167,"""I am sorry that you genuinely believe what you have written about yourself. As I've written before, you sound like such an articulate, intelligent guy and yet you are so down about yourself. You are also not giving your girlfriend any credit by writing that she is just with you because she feels sorry for you. I wish I could say something for you to change this perception of yourself.",,0,,0,
168,Thank you name_token Moderator for the advice!,,0,,0,
169,Thankyou,,0,,0,
170,"I apologise if I jumped to conclusions based on your message but I maintain that with the active social life you live you have LOADS of people who would miss you. Love is not exclusively available from family and partners. You seemed to suggest this was why you were largely unhappy so I think you know what makes you tick; you miss a partner/ family bonds. I'm not going to be stupid enough to say 'fix it' then as it's never that simple, but knowing what would make you happy is a positive; at least it gives you a target.",,0,,0,
171, My problem sounds so small compared to yours. It's great to have someone to chat to though. Especially someone that can relate on the anxiety side of things. Thank you for that. ,"The original text specifically mentioned 'anxiety,' which is a health-sensitive term. It was rephrased to maintain the sentiment without explicitly naming a specific condition, reducing the sensitivity.",4,Mentions anxiety as a health issue.,3,"My concern feels minor compared to yours. It's still wonderful to have someone to talk to, especially someone who understands what I'm going through. Thank you for that."
172,Have you found ways to feel less like a burden?,,0,,0,
173,1. Strong sense of fatigue.,"The original text mentioned a specific symptom 'strong sense of fatigue,' which can imply an underlying medical condition. The rephrased version uses the general term 'tired' to maintain the same expression while reducing the specificity related to health concerns.",4,Strong sense of fatigue.,1,Feeling very tired lately.
174,"Taking vitamins and herbs too are great, as name_token says, B vitamins are great as it helps the nervous system and mood levels too. Taking a good strong multi-vitamin per day too help me, as did high doses of Vitamin C (1000mg-3000mg per day) and immune boosting herbs like siberian ginseng / echinicea. These things definitely boost your immune system and will help with recovery.",The specific details regarding the dosage of Vitamin C and the types of herbs have been removed to generalize the health practices and avoid disclosing personal health regimens. This reduces the sensitivity by avoiding specific reference to certain supplements and their quantities.,5,The mention of taking high doses of Vitamin C (1000mg-3000mg per day) and immune-boosting herbs like Siberian ginseng / echinacea.,1,"Taking vitamins and herbs is beneficial. As name_token says, B vitamins support the nervous system and mood levels. A good multi-vitamin daily is helpful, as well as supplements like immune-boosting herbs."
175,Prices for medicine in Australia are negotiated by the government just like in the UK.,,0,,0,
176,I'm sure you will get great advice from all the ladies here. They are truly a God send,,0,,0,
177,"""Sorry to hear that! If only there were a magic pill.",,0,,0,
178,"For the love of all that is holy, please, please take your meds!","By changing 'take your meds' to 'follow any important daily routines,' the text no longer explicitly mentions medication, thereby removing the direct implication of a health condition or treatment.",5,"The text implies taking medication, suggesting a personal health condition or treatment regimen related to the author.",0,"For goodness' sake, please remember to follow any important daily routines!"
179,Not sleeping,"By changing 'Not sleeping' to 'Having trouble with rest,' the phrase becomes less explicit about potential health issues like insomnia, reducing its sensitivity while preserving the message.",4,"The text indicates not sleeping, which can imply a health-related issue such as insomnia or stress.",1,Having trouble with rest.
180,"""Please forgive me if any of this is presumptious, but I have to reply on a 'feeling' when I am reading strangers' messages and so if any of what I've assumed is incorrect please tell me.",,0,,0,
181,I can't think of anything else right now.,,0,,0,
182,What is a normal Cortisol level for a female,,0,,0,
183,"Thinking about you name_token and hang in there - this forum is a great one with some really good and encouraging people on it, much better than all the scare stories that googling tends to throw up - message any time and let us know how you are doing.",,0,,0,
184,"I am still in contact with Ragnar, do you still chat to him?",,0,,0,
185,One woman wrote about two homeopathic medicines she got from her GP (who seems to know about menopause causing these vibrations)  and it worked very well: no more vibrations and no more waking up in the middle of the night!,"The original text mentioned specific health-related details like menopause, homeopathic medicines, and symptoms experienced. In the rephrased version, I generalized 'homeopathic medicines' to 'remedies,' removed the mention of menopause, and generalized the description of the symptoms to 'issues she was facing earlier.' This preserves the positive outcome of the experience while omitting detailed health-specific information.",5,"The mention of homeopathic medicines prescribed by a GP, the reference to menopause causing vibrations, and the alleviation of symptoms such as vibrations and waking up in the middle of the night.",3,"One woman shared her experience of trying some remedies suggested by her doctor, and they worked very well: she didn't experience the issues she was facing earlier, like waking up in the middle of the night!"
186,"Now you can concentrate on getting prepared for your baby and staying healthy during your pregnancy....please let me know when you deliver, healthy baby, etc...I am overjoyed for you.",,0,,0,
187,"So in summary it's hard to answer you. If I could suggest one thing without offence, it'd be to think what YOU want. You need to be selfish for a bit - what do you want from life, what do you want in a partner, do you want to be single for a bit? Ignore parents, ignore society, ignore expectations. At least then you can find a path to where you want to be - you're never going to please everyone so the easiest thing to do first is please yourself. You're 26, you're not old, you give the impression you're at least attractive and interesting to those you meet and have friends and family who look after you, you are in no rush but just decide what YOU want.",,0,,0,
188,"""Glad we basically agree, just thought it would be interesting to try and get to the bottom of what the absolute cause of these kinds of problems is.",,0,,0,
189,what you should and shouldn't do during the covid-19 pandemic explained with louis tomlinson's songs,,0,,0,
190,"Sorry to hear to are still not better, I wish you all the best with your recovery.",,0,,0,
191,"I recognise issues can tip you over the edge and it certainly sounds like you have plenty of reasons to not be happy at the moment. You have clarified that it wasn't just a bad experience but a career tthreatening one. So whilst my advice to speak to fellow teachers on TES may help with the more general issues, you sound like you're getting the right support and advice in dealing with the bigger picture. I can empathise, I had a similar issue with unions and cases etc (capability procedures against me which were eventually proven to be bullying from them) but I can say even after that experience I have found occasional good schools/ staff. I don't believe all children are lovely, I'm not stupid ha ha! But, and this might be more relevant in Primary, I still believe it is the staff that largely dictate the environment you work in, from direct interaction with you to how the kids respond to them, the routines and the expectations.",,0,,0,
192,"Then down to one tablet of 10mgs, then down to 5mgs before stopping. Ask at a pharmacy if they sell tablet cutters. I don't know if they do. They cut the tablet accurately whereas cutting with a knife is not accurate.","The original text specifies a tapering process of a medication dosage ('one tablet of 10mgs, then down to 5mgs before stopping'), which is health-sensitive as it reveals detailed treatment information. By rephrasing to 'gradually reduce the dosage before stopping,' the specifics are removed while maintaining the advice on dosage reduction.",5,"['one tablet of 10mgs', 'down to 5mgs before stopping']",1,It's important to gradually reduce the dosage before stopping. Ask at a pharmacy if they sell tablet cutters. I don't know if they do. They cut the tablet accurately whereas cutting with a knife is not accurate.
193,"Oh thank God name_token.  I tried to look up CLO and the nearest I could find were nuclear elements.  I thought, where in heck do I find these.😅",,0,,0,
194,The most common thing I hear is that it's caused by anxiety or the medicine to treat it. Can you block out the vibrations or is it always there?,"I replaced 'anxiety or the medicine to treat it' with 'something emotional or the treatment for it' to avoid specifying a medical condition or treatment, making the information less sensitive.",3,anxiety or the medicine to treat it,2,The most common thing I hear is that it's caused by something emotional or the treatment for it. Can you block out the vibrations or is it always there?
195,"""I happened to be online...",,0,,0,
196,Hoping for a good and settled weekend for you.,,0,,0,
197,If anyone has any further suggestions for inclusion do not reply to this but please contact me separately.,,0,,0,
198,"If you can stand two weeks of self-isolation, thereafter, the welcome mat is laid out for you, name_token.",,0,,0,
199,I've been insisting for 5-years that food is a major factor. It can't be co-incidence that so many many people on here point at food.,,0,,0,
200,"once this impacts you to the degree I had to quit my job, it means you cut off a social group and have no money for new experiences/ days out.","The original text implied a possible health issue by mentioning having to quit a job, which may be considered sensitive information. The rephrased version removes the specific context of quitting a job, thus reducing the sensitivity while maintaining the overall message about the consequences of the situation.",2,"The author mentions that they had to quit their job due to the impact of a situation, which could imply a health-related issue.",0,"Once this affects you significantly, it can mean losing a social group and lacking resources for new experiences or days out."
201,"Ha, that's not really great advice. :P I'm not sure I'm describing it right, but I hope you get the gist of what I'm saying.",,0,,0,
202,"During a global pandemic, it can be a death sentence.",,0,,0,
203,"I should probably apply to be a donor now anyway, as I think the process takes some time.",,0,,0,
204,Only felt that on small periods of my life.,,0,,0,
205,"You also mention eventually becoming a burden to your girlfriend. Okay, that might be true. But have you considered why your girlfriend is spending her life with you? It's quite possible that she sees the same qualities in you that I (and possibly others on this board) see. Meaning, you add value to her life too. If not, she would be just another friend who has distanced themselves from you.",,0,,0,
206,"Just lean over sink, put head on one side, apply opening in end of applicator to upper nostril and squeeze, keeping mouth open. Rinse runs out of lower nostril. Repeat in other nostril. Surprisingly comforting if you use boiled water at body temperature.",,0,,0,
207,Wfh day #17 this is where we are at. #fml,,0,,0,
208,"It sure is very useful, thank-you so much",,0,,0,
209," I sailed through my first one and am hoping the second might be even half as good as that, but we don't know. ",,0,,0,
210,"This is devastating to so many who are out of work with no idea how they're going to pay their bills, as well.",,0,,0,
211,"I want to hug you as a friend, that's my feeling since I red your story and the reason I registered and wrote all of this.",,0,,0,
212,"addicted to the money, i can’t stop.",,0,,0,
